{
  "ItemCode": "TMW100L38115",
  "ParentProductCode": "TMW_100L",
  "FileName": "TBUniverseProducts.txt",
  "MessageTimestamp": "2026-05-06T05:49:00Z",
  "Group": "VTCSEPCOATS",
  "SuperGroup": "VTCSEPCOATS",
  "SubDivision": "TOTALSLEEVES",
  "Division": "30",
  "DivisionDescription": "SPORT COATS",
  "SuperDivision": "MEN",
  "ItemCreateDate": "08/18/2022",
  "ItemUpdateDate": "01/09/2025",
  "WebLongDesc": "CALVIN KLEIN SLIM -XFIT- NOTCH SV 2BTN SB SEPARATE COAT",
  "WebFlag": "2",
  "SizeCode": "442",
  "SizeDescription": "44 Regular",
  "PrimarySize": "44",
  "SizeDimension": "REGULAR",
  "SizeSequence": "4300",
  "ProductColorCode": "15",
  "ColorDesc": "BLUE SHARKSKIN",
  "ColorBreakoutDesc": "BLUE SHARKSKIN",
  "ColorFamily": "BLUE",
  "MSRP": "",
  "CurrentCost": "90.00",
  "IsTemporaryMarkDown": "0",
  "IsPermanentMarkdown": "0",
  "Fit": "SLIM FIT",
  "Label": "CALVIN KLEIN X",
  "SeasonCode": "S22",
  "BigAndTallFlag": "0",
  "BTClassCode": "100M",
  "RegClassCode": "100L",
  "HazardousFlag": "0",
  "NoWarehouseStock": "1",
  "TaxTypeTaxware": "2038356",
  "HeelHeight": "",
  "Length": "",
  "Material": "WOOL",
  "Content": "100%WOOL NATURAL STRETCH",
  "Pattern": "SOLID",
  "Wash": "",
  "Origin": "IMPORTED",
  "SpecialSizes": "MENS REGULAR",
  "Gender": "",
  "CollectionName": "",
  "CareInstructions": "DRY CLEAN ONLY",
  "Categories": "TUXEDOS",
  "Width": "",
  "JacketStyle": "2-BUTTON",
  "JacketLining": "FULL LINED",
  "JacketVent": "SIDE-VENTED",
  "PantStyle": "",
  "PantFinish": "",
  "AccessoryStyle": "",
  "LapelStyle": "NOTCH LAPEL",
  "PocketStyle": "FLAP POCKET",
  "ShirtCollarStyle": "",
  "ShirtCuffStyle": "",
  "SleeveLength": "",
  "ShoeStyle": "",
  "ShoeToeStyle": "",
  "ShoeSoleMaterial": "",
  "ProductFeatures": "",
  "AdditionalCopy": "<><><><>PIC STITCH",
  "ProductAssociation": "100L<>100M",
  "DateAvailableToSell": "08/30/2022",
  "UPC": "",
  "LeverageClassCode": "",
  "Occasion": "",
  "Creaset": "",
  "Hem": "",
  "MaxHemLength": "49",
  "Monogramming": "",
  "PackageQty": "",
  "IsBundle": "0"
}
